headline,article_link,is_sarcastic
“We don’t manipulate the news” say 8 Murdoch mastheads in unison ,https://chaser.com.au/national/we-dont-manipulate-the-news-say-8-mastheads-in-unison/,1
News Corp really hoping no satire site reposts Rudd’s senate speech in full ,https://chaser.com.au/general-news/news-corp-really-hoping-no-satire-site-reposts-rudds-senate-speech-in-full/,1
Morrison explains he was only vaccinated in case of emergency holiday to Hawaii ,https://chaser.com.au/general-news/morrison-explains-he-was-only-vaccinated-in-case-of-emergency-holiday-to-hawaii/,1
Media Diversity Inquiry asks a bunch of rich old white men whether they have a diversity issue ,https://chaser.com.au/national/media-diversity-inquiry-asks-a-bunch-of-rich-old-white-men-whether-they-have-a-diversity-issue/,1
Vaccine queue jumper to be sent straight to Manus Island ,https://chaser.com.au/national/vaccine-queue-jumper-to-be-sent-straight-to-manus-island/,1
White House declares Ted Cruz a national disaster ,https://chaser.com.au/general-news/white-house-declares-ted-cruz-a-national-disaster/,1
News free Facebook user blissfully unaware of unfolding alien invasion ,https://chaser.com.au/general-news/news-free-facebook-user-blissfully-unaware-of-unfolding-alien-invasion/,1
‘I don’t have an issue with how I treat women’ claims PM who hurt an old lady during photo op ,https://chaser.com.au/general-news/i-dont-have-an-issue-with-how-i-treat-women-claims-pm-who-hurt-an-old-lady-during-photo-op/,1
Teenager that’s been watching porn since 13 confused what all this ‘taco’ nonsense is about ,https://chaser.com.au/national/teenager-thats-been-watching-porn-since-13-confused-what-all-this-taco-nonsense-is-about/,1
Cancel Culture strikes again as snowflakes ruin Ted Cruz’s holiday ,https://chaser.com.au/world/cancel-culture-strikes-again-as-snowflakes-ruin-ted-cruzs-holiday/,1
“We’re giving The Chaser a new show” says ABC who can’t dispute this cause they’re blocked ,https://chaser.com.au/entertainment/were-giving-the-chasers-another-tv-show-says-abc-who-cant-dispute-this-because-theyre-blocked/,1
Mediocre couple not cheating on each other despite best efforts ,https://chaser.com.au/national/mediocre-couple-not-cheating-on-each-other-despite-best-efforts/,1
PM announces investigation will be an ‘arms-length’ away from being independent ,https://chaser.com.au/national/pm-announces-investigation-will-be-an-arms-length-away-from-being-independent/,1
Facebook bans newsfeed after realising it has the word ‘news’ in it ,https://chaser.com.au/national/facebook-bans-newsfeed-after-realising-it-has-the-word-news-in-it/,1
Kevin Rudd calls for new senate inquiry into The Chaser’s news monopoly ,https://chaser.com.au/general-news/kevin-rudd-calls-for-new-senate-inquiry-into-the-chasers-news-monopoly/,1
Ted Cruz starting to regret hiring ScoMo’s empathy consultant ,https://chaser.com.au/national/ted-cruz-starting-to-regret-hiring-scomos-empathy-consultant/,1
Local FB user experiences first enjoyable day in years ,https://chaser.com.au/general-news/local-fb-user-experiences-first-enjoyable-day-in-years/,1
“Facebook never warned this would happen” says Govt months after being warned this would happen ,https://chaser.com.au/national/facebook-never-warned-this-would-happen-says-govt-months-after-warning-this-would-happen/,1
Govt wishing there was some other way to fund journalism with big companies money ,https://chaser.com.au/national/govt-wishing-there-was-some-other-way-to-fund-journalism-with-big-companies-money/,1
Aussie media knows it’s fucked after Frydenberg says he’ll sort this out ,https://chaser.com.au/general-news/aussie-media-knows-its-fucked-after-frydenberg-says-hell-sort-this-out/,1
Nation’s broadsheets announce new retail price of $50.99 ,https://chaser.com.au/national/nations-broadsheets-announce-new-retail-price-of-50-99/,1
A complete list of the Liberal Party’s corruption over the last 7 years ,https://chaser.com.au/national/an-exhaustive-list-of-the-liberal-partys-corruption-over-the-last-7-years/,1
Facebook finally crack down on racism by banning all Aussie media ,https://chaser.com.au/general-news/facebook-finally-crack-down-on-racism-by-banning-all-aussie-media/,1
Channel 9 journo forced to hit streets to inform public about great savings at Harvey Norman ,https://chaser.com.au/national/channel-9-journo-forced-to-hit-streets-to-inform-public-about-great-savings-at-harvey-norman/,1
Daily Mail reader struggling to cope without crucial updates on Miley Cyrus’s bra size ,https://chaser.com.au/national/daily-mail-reader-struggling-to-cope-without-crucial-updates-on-miley-cyruss-bra-size/,1
Anti-Vax Facebook mum glad to see her ‘real news’ sources are still up ,https://chaser.com.au/general-news/anti-vax-facebook-mum-glad-to-see-her-real-news-sources-are-still-up/,1
Harry and Meghan finally achieve privacy by agreeing to interview on Studio 10 ,https://chaser.com.au/national/harry-and-meghan-maintain-complete-privacy-by-agreeing-to-interview-on-studio-10/,1
Facebook restores Daily Telegraph page after realising they’re not real news ,https://chaser.com.au/national/facebook-restores-daily-telegraph-page-after-realising-theyre-not-real-news/,1
Report: Aw fuck ,https://chaser.com.au/national/report-aw-fuck/,1
Jenny Morrison appointed the new Minister For Knowing Things You’d Think Would Be Obvious ,https://chaser.com.au/national/jenny-morrison-appointed-the-new-minister-for-knowing-things-youd-think-would-be-obvious/,1
Morrison denies Liberal party is sexist – “Just ask the Minister for Women” ,https://chaser.com.au/national/morrison-denies-sexism-allegations-ive-been-cleared-by-the-minister-for-women/,1
"Man who spent $200,000 on empathy consultant unable to work out rape is wrong ",https://chaser.com.au/general-news/man-who-spent-200000-on-empathy-consultants-apparently-unable-to-work-out-rape-is-wrong/,1
‘Covering up the rape of a woman is bad because it could upset her dad’ says PM ,https://chaser.com.au/national/covering-up-the-rape-of-a-woman-is-bad-because-it-could-upset-her-dad-says-pm/,1
Robodebt victim starting to wish they had just run a billion dollar money laundering scheme ,https://chaser.com.au/national/robodebt-victim-starting-to-wish-they-had-just-run-billion-dollar-money-laundering-scheme/,1
Republicans vote to acquit Osama bin Laden ,https://chaser.com.au/world/republicans-vote-to-acquit-osama-bin-laden/,1
Man insists support for lockdown is unrelated to forgetting to buy Valentine’s gift ,https://chaser.com.au/general-news/local-man-insists-support-for-lockdown-has-nothing-to-do-with-forgetting-to-buy-valentines-gift/,1
Liberal party wondering why Rowland can’t be more like guy who asked why pedos keep getting jailed ,https://chaser.com.au/national/michael-rowland-praised-for-right-wing-balance-after-asking-why-pedos-keep-getting-jailed/,1
Coalition reveal new budget saving strategy of not bothering to investigate corruption ,https://chaser.com.au/national/coalition-reveal-new-budget-saving-strategy-of-not-bothering-to-investigate-corruption/,1
“Any claims that I am corrupt are highly defamatory” says corrupt minister Peter Dutton ,https://chaser.com.au/national/any-claims-that-i-am-corrupt-are-highly-defamatory-says-corrupt-minister-peter-dutton/,1
"Order of Australia holds emergency meeting to discuss last minute awards for Eddie McGuire, James Packer ",https://chaser.com.au/national/order-of-australia-holds-emergency-meeting-to-discuss-last-minute-awards-for-eddie-mcguire-james-packer/,1
Family finally get government to pay for childcare by changing kid’s name to “Coal” ,https://chaser.com.au/general-news/family-finally-get-government-to-pay-for-childcare-by-changing-kids-name-to-coal/,1
The Chaser’s Valentines Cards ,https://chaser.com.au/general-news/the-chasers-valentines-cards/,1
"“I am disappointed with myself for how, under my watch, the report leaked” says McGuire ",https://chaser.com.au/sport/i-am-disappointed-with-myself-for-how-under-my-watch-the-report-leaked-says-mcguire/,1
"Sydney scraps lockout laws, leaving only Sydney’s venues, people as reason not to go out ",https://chaser.com.au/general-news/sydney-removes-lockout-laws-leaving-only-sydney-as-reason-not-to-go-out/,1
Collingwood announce it a “proud day for Eddie McGuire” after he is given the sack ,https://chaser.com.au/national/collingwood-announce-it-a-proud-day-for-eddie-mcguire-after-he-is-given-the-sack/,1
Shock as company that lets drunk addicts pour money into machines rigged to lose is ruled unethical ,https://chaser.com.au/national/shock-as-company-that-lets-drunk-addicts-pour-money-into-machines-rigged-to-lose-is-ruled-unethical/,1
"‘If your super isn’t enough to buy a house, just use $200k from your savings’ says Government ",https://chaser.com.au/national/if-your-super-isnt-enough-to-buy-a-house-just-use-200k-from-your-savings-says-government/,1
Local man pretty suss ,https://chaser.com.au/national/local-man-pretty-suss/,1
“All views should be heard and debated” says possible horse molester Craig Kelly ,https://chaser.com.au/general-news/all-views-should-be-heard-and-debated-says-possible-horse-molester-craig-kelly/,1
Google tells Morrison they know about searches for ‘hillsong milfs’ ,https://chaser.com.au/national/google-tells-morrison-they-know-about-searches-for-hillsong-milfs/,1
Labor immediately scraps plan for ScoMo style name for Anthony Albanese ,https://chaser.com.au/national/labor-immediately-scraps-plan-for-scomo-style-name-for-anthony-albanese/,1
Home and Away Snubbed Again by 2021 Golden Globes ,https://chaser.com.au/general-news/home-and-away-snubbed-again-by-2021-golden-globes/,1
Google agrees to stay in Australia as long as they never have to chat with Morrison again ,https://chaser.com.au/national/google-agrees-to-stay-in-australia-as-long-as-they-never-have-to-chat-with-morrison-again/,1
‘Teachers inappropriately give kids climate change information’ says guy who gave student love letters ,https://chaser.com.au/general-news/teachers-inappropriately-give-kids-climate-change-information-says-guy-who-gave-student-love-letters/,1
Morrison’s approval rate drops to 2% after suggesting Australians use Bing ,https://chaser.com.au/national/morrisons-approval-rate-drops-to-2-after-suggesting-australians-use-bing/,1
PM slams Facebook for not reining in Craig Kelly ,https://chaser.com.au/national/pm-slams-facebook-for-not-reining-in-craig-kelly/,1
Hedge Fund manager now as financially bankrupt as they are morally ,https://chaser.com.au/general-news/hedge-fund-manager-now-as-financially-bankrupt-as-they-are-morally/,1
"‘Don’t worry, I got this,’ says leader who clearly hasn’t got this ",https://chaser.com.au/national/dont-worry-i-got-this-says-leader-who-clearly-hasnt-got-this/,1
Struggling Wall Street investor forced to start GoFundMe to buy next yacht ,https://chaser.com.au/general-news/struggling-wall-street-investor-forced-to-start-gofundme-to-buy-next-yacht/,1
Confused Pauline Hanson joins Invasion Day protests against ‘foreigners coming and taking over’ ,https://chaser.com.au/general-news/confused-pauline-hanson-joins-invasion-day-protests-against-foreigners-coming-and-taking-over/,1
"“Australia Day is a day to unify everyone, so it must remain on the divisive date” says PM ",https://chaser.com.au/national/australia-day-is-a-day-to-unify-everyone-so-it-must-remain-on-the-divisive-date-says-pm/,1
Government cancels Australia Day after learning it celebrates boat people ,https://chaser.com.au/national/peter-dutton-calls-for-australia-day-to-be-scrapped-after-learning-it-celebrates-boat-people/,1
Local hero rewarded by not being given an Australia Day honour ,https://chaser.com.au/general-news/local-hero-rewarded-by-not-being-given-an-australia-day-honour/,1
Australia day renamed Ruby Princess Day in commemoration of another boat that fucked everything up ,https://chaser.com.au/national/australia-day-renamed-ruby-princess-day-in-commemoration-of-another-boat-that-fucked-everything-up/,1
"‘Don’t worry Australia, you will still have Microsoft Bing,’ says the Bing of Prime Ministers ",https://chaser.com.au/national/dont-worry-australia-you-will-still-have-microsoft-bing-says-the-bing-of-prime-ministers/,1
"As Google threatens to block search in Australia, nation fires up the ol’ Ask Jeeves ",https://chaser.com.au/general-news/as-google-threatens-to-block-search-in-australia-nation-fires-up-the-ol-ask-jeeves/,1
Man in room next to tennis player about to lose his fucking mind ,https://chaser.com.au/sport/man-in-room-next-to-tennis-player-about-to-lose-his-fucking-mind/,1
"‘It’s not Invasion Day, it’s a day to simply celebrate the invasion of Australia’ says PM ",https://chaser.com.au/national/its-not-invasion-day-its-a-day-to-simply-celebrate-the-invasion-of-australia-says-pm/,1
Trump drowns his sorrows with a strong glass of bleach ,https://chaser.com.au/world/trump-drowns-his-sorrows-with-a-strong-glass-of-bleach/,1
Fox News blasts Biden for “unacceptable” 4 COVID deaths on his watch ,https://chaser.com.au/general-news/fox-news-blasts-biden-for-unacceptable-4-covid-deaths-on-his-watch/,1
World excited to be bored by politics again ,https://chaser.com.au/world/world-excited-to-be-bored-by-politics-again/,1
Trump regretting not banning evictions during covid ,https://chaser.com.au/world/trump-regretting-not-banning-evictions-during-covid/,1
Nurse coming off a double-shift devastated to hear a model had to wash her own hair ,https://chaser.com.au/entertainment/nurse-coming-off-a-double-shift-devastated-to-hear-a-model-had-to-wash-her-own-hair/,1
Pigeon allowed to stay in Melbourne after an intense two days of tennis lessons ,https://chaser.com.au/general-news/pigeon-allowed-to-stay-in-melbourne-after-an-intense-two-days-of-tennis-lessons/,1
Trump to put AUSTRAC in charge of vote recount ,https://chaser.com.au/world/trump-to-put-austrac-in-charge-of-vote-recount/,1
Peter Dutton spends day strangling local pigeons in case one of them might be American ,https://chaser.com.au/national/peter-dutton-spends-day-strangling-local-pigeons-in-case-one-of-them-might-be-american/,1
Dutton unveils new $1 billion pigeon border force ,https://chaser.com.au/national/dutton-unveils-new-1-billion-pigeon-border-force/,1
Australian government to extradite American pigeon over fears it was planning a coo ,https://chaser.com.au/national/australian-government-to-extradite-american-pigeon-over-fears-it-was-planning-a-coo/,1
Michael McCormack demands Cheer Cheese changes its name to ‘All Cheese Matters’ ,https://chaser.com.au/national/michael-mccormack-demands-cheer-cheese-changes-its-name-to-all-cheese-matters/,1
Chaser launches attack ad against rival satirical news organisation ,https://chaser.com.au/general-news/why-would-you-trust-sky-news/,1
Shock as McConnell says he’ll support impeachment of man who sent angry mob to kill him ,https://chaser.com.au/world/shock-as-mitch-mcconnell-announces-he-wont-oppose-impeachment-of-man-who-sent-an-angry-mob-to-kill-him/,1
Fruit picking shortage solved by Michael McCormack’s massive effort cherry-picking facts ,https://chaser.com.au/national/fruit-picking-shortage-solved-by-michael-mccormacks-massive-effort-cherry-picking-facts/,1
George Pell announces he will start streaming Minecraft on Twitch ,https://chaser.com.au/general-news/george-pell-announces-he-will-start-streaming-minecraft-on-twitch/,1
Orwell and Marx sign open letter begging idiots to stop bringing them up all the time ,https://chaser.com.au/world/orwell-and-marx-sign-open-letter-begging-idiots-to-stop-bringing-them-up-all-the-time/,1
"Trump: I did not lose my Twitter access, I won it by a landslide ",https://chaser.com.au/world/trump-i-did-not-lose-my-twitter-access-i-won-it-by-a-landslide/,1
"Hampered by Covid travel restrictions, CIA employees trial ‘Coup From Home’ model ",https://chaser.com.au/world/hampered-by-covid-travel-restrictions-cia-trials-coup-from-home-model/,1
Trump forced to ride out twitter ban by reorganising his top friends on MySpace ,https://chaser.com.au/world/trump-forced-to-ride-out-twitter-ban-by-reorganising-his-top-friends-on-myspace/,1
"After running out of foreign governments to overthrow, America forced to topple own government for a change ",https://chaser.com.au/world/after-running-out-of-foreign-governments-to-overthrow-america-forced-to-topple-own-government-for-a-change/,1
Breaking: America ,https://chaser.com.au/world/breaking-america/,1
Nation that never shuts up about democracy opts to just ignore president trying to subvert election ,https://chaser.com.au/world/nation-that-never-shuts-up-about-democracy-opts-to-just-ignore-president-trying-to-subvert-election/,1
"SCG announces Super Spreader ticket deal: “buy one, kill one family member” ",https://chaser.com.au/sport/scg-announces-super-spreader-ticket-deal-buy-1-ticket-and-kill-1-family-member-absolutely-free/,1
"“There is no way next year could be worse than this year,” says guy for fifth year in a row ",https://chaser.com.au/general-news/there-is-no-way-next-year-could-be-worse-than-this-year-says-guy-for-fifth-year-in-a-row/,1
Scott Morrison enjoying well-earned break to spend time with his coal ,https://chaser.com.au/general-news/scott-morrison-says-he-is-enjoying-having-time-off-to-spend-with-his-coal/,1
“You can’t change Australia Day’s date” says man celebrating Jesus’s birth on Dec 25th ,https://chaser.com.au/general-news/you-cant-change-australia-days-date-says-man-celebrating-jesuss-birth-on-dec-25th/,1
Goverment forced to cancel Christmas after learning it celebrates refugee family ,https://chaser.com.au/national/goverment-forced-to-cancel-christmas-after-learning-it-celebrates-refugee-family/,1
NSW resident devastated he won’t get to hear racist uncle’s views this Christmas ,https://chaser.com.au/general-news/nsw-residents-devastated-they-wont-get-to-hear-their-queensland-uncles-racist-views-on-diversity-this-christmas/,1
Manhunt Underway for a SAS Soldier Who Has Not Drunk from a Prosthetic Leg ,https://chaser.com.au/general-news/manhunt-underway-for-sas-soldier-who-has-not-drunk-from-a-prosthetic-leg/,1
Gladys Berejiklian Looking for Corrupt Minister to Isolate with this Christmas ,https://chaser.com.au/general-news/gladys-berejiklian-looking-for-corrupt-minister-to-isolate-with-this-christmas/,1
PM concerned the new covid wave in Sydney could pose a real risk to the Cronulla Sharks ,https://chaser.com.au/general-news/pm-concerned-the-new-covid-wave-in-sydney-could-pose-a-real-risk-to-the-cronulla-sharks/,1
Morrison takes action on Christmas COVID outbreak by flying immediately to Hawaii ,https://chaser.com.au/national/morrison-takes-action-on-christmas-covid-outbreak-by-flying-immediately-to-hawaii/,1
“Why won’t you listen to medical science” yells man who thinks ADHD is an alien hoax ,https://chaser.com.au/entertainment/why-wont-you-listen-to-medical-science-yells-man-who-thinks-adhd-is-an-alien-hoax/,1
Treasurer slams banks for not investing in bad investment that destroys the planet ,https://chaser.com.au/national/treasurer-calls-for-inquiry-after-banks-stop-investing-in-planet-destroying-fuel-with-falling-demand-for-some-reason/,1
"“Australia is doing a lot to combat climate change, despite my best efforts,” defends Morrison ",https://chaser.com.au/national/australia-is-doing-a-lot-to-combat-climate-change-despite-my-best-efforts-defends-morrison/,1
“Ok now China has actually crossed the line targeting our heroic coal” says furious Morrison ,https://chaser.com.au/national/ok-now-china-has-actually-crossed-the-line-targeting-our-heroic-coal-says-furious-morrison/,1
DIY Hobbyist Can’t Understand Why He Wasn’t Invited to Climate Summit ,https://chaser.com.au/general-news/diy-hobbyist-cant-understand-why-he-wasnt-invited-to-climate-summit/,1
T2 box to be re-gifted for third Christmas in a row ,https://chaser.com.au/general-news/t2-box-to-be-re-gifted-for-third-christmas-in-a-row/,1
Donald Trump begins workshopping fresh conspiracies for 2024 election loss ,https://chaser.com.au/world/donald-trump-begins-workshopping-fresh-conspiracies-for-2024-election-loss/,1
Trump Pens letter to Santa asking for ‘proof of voter fraud’ this Christmas ,https://chaser.com.au/world/trump-pens-letter-to-santa-asking-for-proof-of-voter-fraud-this-christmas/,1
George Pell gets in the Christmas Spirit by applying for a job as a mall Santa ,https://chaser.com.au/general-news/george-pell-gets-in-the-christmas-spirit-by-applying-for-a-job-as-a-mall-santa/,1
"“If Santa really cared about kids, he would restrict them to cashless cards” says Govt ",https://chaser.com.au/national/if-santa-really-cared-about-kids-he-would-restrict-them-to-cashless-cards-says-govt/,1
"Universal buys Bob Dylan songs for $400m, only to discover Spotify costs $10.99 a month ",https://chaser.com.au/entertainment/universal-buys-bob-dylan-songs-for-300m-only-to-discover-spotify-costs-10-99-a-month/,1
“No vaccines for my pure body” says woman coming off a 2 day bender ,https://chaser.com.au/world/no-vaccines-for-my-pure-body-says-woman-coming-off-a-2-day-bender/,1
"PM apologises to Rudd – leaving only stranded Aussies, bush fire victims, the environment, robodebt victims, Bunnings employees… ",https://chaser.com.au/national/pm-apologises-to-rudd-leaving-only-stranded-aussies-bush-fire-victims-the-environment-robodebt-victims-bunnings-employees/,1
Rudy Gulliani catches bio weapon hoax virus to stop him from protecting the election from being rigged by freedom of choice ,https://chaser.com.au/world/rudy-gulliani-catches-bio-weapon-hoax-virus-to-stop-him-from-protecting-the-election-from-being-rigged-by-freedom-of-choice/,1
Dictator Dan slammed after tourists enter Victoria due to his stupid decision to trust NSW officials ,https://chaser.com.au/general-news/dictator-dan-slammed-after-tourists-enter-victoria-due-to-his-stupid-decision-to-trust-nsw-officials/,1
NSW Police explain German traveler stuff up- “we were too busy strip searching teens” ,https://chaser.com.au/general-news/nsw-police-explain-german-traveler-stuff-up-we-were-too-busy-strip-searching-teens/,1
Rudy Giuliani to undergo hotel quarantine at Four Seasons landscaping ,https://chaser.com.au/world/rudy-giuliani-to-undergo-hotel-quarantine-at-four-seasons-landscaping/,1
"For Disability Day, TV show graciously gives disabled person spot they’d normally give racist ",https://chaser.com.au/entertainment/for-disability-day-tv-show-graciously-gives-disabled-person-spot-theyd-normally-give-racist/,1
NSW legalises drugs – Police forced to come up with new excuse to strip search 12 yo’s ,https://chaser.com.au/news/nsw-legalises-drugs-police-forced-to-come-up-with-new-excuse-to-strip-search-12-yos/,1
“Difference is we own up to our war crimes” says PM still charging the whistleblower ,https://chaser.com.au/general-news/difference-is-we-own-up-to-our-war-crimes-says-pm-charging-the-whistle-blower/,1
Furious Trump reduced to sounding off in PornHub comments section ,https://chaser.com.au/world/furious-trump-forced-to-sound-off-in-pornhub-comments-section/,1
Andrew Bolt blasts people fleeing bushfires “We can’t let fire stop us living our lives” ,https://chaser.com.au/general-news/andrew-bolt-blasts-people-fleeing-bushfires-we-cant-let-fire-stop-us-living-our-lives/,1
Morrison fires back at China with spicy distracted boyfriend meme ,https://chaser.com.au/national/morrison-fires-back-at-china-with-spicy-distracted-boyfriend-meme/,1
"Following The Crown’s lead, Sky News to pre-warn viewers that their stories are mostly fiction ",https://chaser.com.au/national/following-the-crowns-lead-sky-news-to-pre-warn-viewers-that-stories-are-mostly-fiction/,1
Triple J announce hip new breakfast host Alan Jones ,https://chaser.com.au/national/triple-j-announce-hip-new-breakfast-host-alan-jones/,1
Jobseeker Mathias Cormann hit with $28 million robodebt bill ,https://chaser.com.au/national/jobseeker-mathias-cormann-hit-with-28-million-robodebt-bill/,1
Jobseeker Mathias Cormann forced to wait on hold for 8 hours to get Jet refueled by centrelink ,https://chaser.com.au/national/jobseeker-mathias-cormann-forced-to-wait-on-hold-for-8-hours-to-get-jet-refueled-by-centrelink/,1
Struggling Jobseeker Mathias Cormann forced to choose between paying rent and keeping jet ,https://chaser.com.au/national/struggling-jobseeker-mathias-cormann-forced-to-choose-between-paying-rent-and-keeping-jet/,1
War Memorial annouces exhibit on the horrors of Channel 7’s SAS ,https://chaser.com.au/national/war-memorial-annouces-exhibit-on-the-horrors-of-channel-7s-sas/,1
Minister for Women Tony Abbott spotted in Scotland giving free tampons to himself ,https://chaser.com.au/general-news/minister-for-women-tony-abbott-spotted-in-scottland-giving-free-tampons-to-himself/,1
Kerry Stokes offers to pay for new War Memorial exhibit celebrating war crimes ,https://chaser.com.au/national/kerry-stokes-offers-to-pay-for-new-war-memorial-exhibit-celebrating-war-crimes/,1
"“Let young people buy houses with super, it’s not like they’ll get to retire anyway” says LNP ",https://chaser.com.au/national/let-young-people-buy-houses-with-super-its-not-like-theyll-get-to-retire-anyway-says-lnp/,1
Trump demands recount of his children after Tiffany shows up to dinner ,https://chaser.com.au/national/trump-demands-recount-of-his-children-after-tiffany-shows-up-to-dinner/,1
Federal government furious Dan Andrews didn’t prevent ADF war crimes ,https://chaser.com.au/national/federal-government-furious-dan-andrews-didnt-prevent-adf-war-crimes/,1
Mooching foreigner caught bludging off government handouts ,https://chaser.com.au/general-news/dole-bludging-foreigner-asks-government-for-handout-despite-secret-billions/,1
